{
  "audit_id": "AUDIT-SG-B4-SG-V7L-2026-09-11",
  "auditor": "CLAUDE",
  "auditor_instance": "CLAUDE-FRESH-B4-SG-V7L",
  "audit_date": "2026-09-11",
  "independent": true,
  "audit_status": "FULLY_ADJUDICATED",
  "represented_freeze_sha": "807d5eb08500851c7ce53c267a465f167fc2b637",
  "audit_package_path": "audits/study_guide/2026-09-11/BATCH4-SG-V7L-AUDIT-PACKAGE.json",
  "audit_package_sha256": "5e856f7f4493377efc89d3bbe6a56228b29748fbefb999091f2b416e912fd128",
  "section_ids": [
    "SG-CONTROLLED-SCHEDULES"
  ],
  "section_hashes": {
    "SG-CONTROLLED-SCHEDULES": "904a7e17f064ee30e533615ff041dbaae2137f8f6de5c0c10cfc8ca51b3d589a"
  },
  "dependency_snapshots": {
    "SG-CONTROLLED-SCHEDULES": {
      "section_content_hash": "904a7e17f064ee30e533615ff041dbaae2137f8f6de5c0c10cfc8ca51b3d589a",
      "rule_dependencies": [
        {
          "rule_id": "FED-CS-SCHEDULES",
          "content_version": 1,
          "content_hash": "7b4b6f9f82c86944dd8cefc1dd1aa2e684bfff4dd4aaed21d99e68c1091d025c"
        },
        {
          "rule_id": "MA-SCHEDULE-VI",
          "content_version": 1,
          "content_hash": "32fcadb1dec76d25a808999b3a42bd3afa4c2c952665d42512ab6cfeb60eb5c9"
        }
      ],
      "practice_question_dependencies": [
        {
          "question_id": "MA-Q-0009",
          "question_hash": "e85f485729b440b2b5b7308d15a772beb98b4c14e952c4a098c63d5fe9d5ece8"
        }
      ]
    }
  },
  "results": [
    {
      "section_id": "SG-CONTROLLED-SCHEDULES",
      "section_hash": "904a7e17f064ee30e533615ff041dbaae2137f8f6de5c0c10cfc8ca51b3d589a",
      "disposition": "MINOR_EDIT",
      "severity": "High",
      "criteria": {
        "paraphrase_fidelity": "FAIL",
        "material_exceptions": "FAIL",
        "ma_vs_federal_distinctions": "FAIL",
        "actor_and_scope": "PASS",
        "deadlines": "PASS",
        "forms": "PASS",
        "decision_logic": "FAIL",
        "overgeneralization": "FAIL",
        "unsupported_propositions": "PASS",
        "practice_question_mapping": "FAIL",
        "study_usefulness_without_legal_distortion": "FAIL"
      },
      "findings": [
        {
          "severity": "High",
          "criterion": "ma_vs_federal_distinctions",
          "location": "orientation[2].text (see also ma_vs_federal[0].text)",
          "problem": "The section tells the candidate that reading 'Schedule VI' as 'a sixth and gentlest tier of controlled-substance regulation' is a misreading, because 'in substance it is the set of ordinary prescription medicines'. Under Massachusetts law that reading is correct: every Schedule VI drug is a Massachusetts controlled substance. The section never says so. And ma_vs_federal[0] leaves out the distinction the declared subtopic most needs: Schedule VI drugs are controlled substances under Massachusetts law, but they are not federally controlled.",
          "rationale": "M.G.L. c. 94C, § 1 defines 'controlled substance' as a drug, substance, controlled substance analogue or immediate precursor 'in any schedule or class referred to in this chapter'. § 3(6) makes Schedule VI a statutory schedule: a prescription drug not included in Schedules I through V. § 2(a) directs the Commissioner to establish the sixth schedule as part of regulating the manufacture, distribution, dispensing and possession of controlled substances. The regulation says the same. 105 CMR 700.002 opens 'The following schedules of controlled substances are established' before subsections (A) through (F). 105 CMR 700.001 defines 'Controlled Substance' in the same terms, and defines 'Additional Drug' as 'a controlled substance in Schedule VI'. 105 CMR 700.006(I)(3) sets 'controlled substances listed in Schedule VI' against 'non-controlled substances'. Massachusetts consequences attach through that status. For example, c. 94C, § 7(a) requires registration of non-pharmacy persons who dispense 'any controlled substance', and 105 CMR 700.006(F)(4) requires records of Schedule VI sample medications. The accurate teaching is that Schedule VI is Massachusetts's least restrictive controlled-substance schedule. It carries no federal controls and none of the Massachusetts Schedule II-V rules, but it is not outside controlled-substance regulation. A candidate following the section would mark false a true proposition: in Massachusetts, a prescription drug outside Schedules I-V is a controlled substance.",
          "authorities": [
            {
              "official_url": "https://malegislature.gov/Laws/GeneralLaws/PartI/TitleXV/Chapter94C/Section1",
              "exact_section": "M.G.L. c. 94C, § 1 (definitions of 'Controlled substance' and 'Prescription drug')",
              "checked_date": "2026-09-11"
            },
            {
              "official_url": "https://malegislature.gov/Laws/GeneralLaws/PartI/TitleXV/Chapter94C/Section2",
              "exact_section": "M.G.L. c. 94C, § 2(a), (a½), (c) (six schedules; Commissioner may delete or reschedule; 30-day conforming regulation; OTC exclusion)",
              "checked_date": "2026-09-11"
            },
            {
              "official_url": "https://malegislature.gov/Laws/GeneralLaws/PartI/TitleXV/Chapter94C/Section3",
              "exact_section": "M.G.L. c. 94C, § 3 (lead-in; (6) Schedule VI findings)",
              "checked_date": "2026-09-11"
            },
            {
              "official_url": "https://malegislature.gov/Laws/GeneralLaws/PartI/TitleXV/Chapter94C/Section7",
              "exact_section": "M.G.L. c. 94C, § 7(a) (registration of persons who dispense any controlled substance, except pharmacies, wholesale druggists and outsourcing facilities)",
              "checked_date": "2026-09-11"
            },
            {
              "official_url": "https://www.mass.gov/doc/105-cmr-700-implementation-of-mgl-c94c-0/download",
              "exact_section": "105 CMR 700.001 (definitions of Additional Drug, Controlled Substance, Prescription Drug); official PDF served 2026-09-11, Last-Modified 2024-02-02",
              "checked_date": "2026-09-11"
            },
            {
              "official_url": "https://www.mass.gov/doc/105-cmr-700-implementation-of-mgl-c94c-0/download",
              "exact_section": "105 CMR 700.002 lead-in and (A)-(F)",
              "checked_date": "2026-09-11"
            },
            {
              "official_url": "https://www.mass.gov/doc/105-cmr-700-implementation-of-mgl-c94c-0/download",
              "exact_section": "105 CMR 700.006(A), (F)(4), (I)(3)",
              "checked_date": "2026-09-11"
            }
          ]
        },
        {
          "severity": "Medium",
          "criterion": "study_usefulness_without_legal_distortion",
          "location": "worked_examples[0].resolution",
          "problem": "The scenario asks whether a Massachusetts Schedule VI drug carries 'the record and reporting duties that attach to controlled substances'. The resolution answers that 'nothing else follows automatically', and it labels 'reading Schedule VI as a sixth tier of controlled-substance regulation' part of the error. That gives a Massachusetts candidate the wrong frame. The drug is a Massachusetts controlled substance in Schedule VI, and some Massachusetts record and reporting rules do reach Schedule VI.",
          "rationale": "The authorities are the same as for the orientation[2] finding. In addition, three rules reach Schedule VI. 105 CMR 700.006(I)(3) requires pharmacies in registered health facilities to file prescriptions for 'controlled substances listed in Schedule VI' in a designated file. 105 CMR 700.006(F)(4) requires a registered practitioner to keep records of Schedule VI sample medications dispensed. 105 CMR 700.012(A)(1) makes a Schedule VI drug MassPAT-reportable when the Department classifies it as an additional drug. The correct resolution has three parts. No federal controlled-substance duty arises, because the drug is not in 21 CFR 1308.11-1308.15. No Massachusetts Schedule II-V duty arises either. But the drug is a Massachusetts Schedule VI controlled substance, so the candidate must open the Massachusetts rule for the act, which may or may not impose a duty. The error the scenario invites is importing federal and Schedule II-V duties. Recognising Schedule VI as a controlled-substance schedule is not an error.",
          "authorities": [
            {
              "official_url": "https://malegislature.gov/Laws/GeneralLaws/PartI/TitleXV/Chapter94C/Section1",
              "exact_section": "M.G.L. c. 94C, § 1 (definitions of 'Controlled substance' and 'Prescription drug')",
              "checked_date": "2026-09-11"
            },
            {
              "official_url": "https://www.mass.gov/doc/105-cmr-700-implementation-of-mgl-c94c-0/download",
              "exact_section": "105 CMR 700.001 (definitions of Additional Drug, Controlled Substance, Prescription Drug); official PDF served 2026-09-11, Last-Modified 2024-02-02",
              "checked_date": "2026-09-11"
            },
            {
              "official_url": "https://www.mass.gov/doc/105-cmr-700-implementation-of-mgl-c94c-0/download",
              "exact_section": "105 CMR 700.002 lead-in and (A)-(F)",
              "checked_date": "2026-09-11"
            },
            {
              "official_url": "https://www.mass.gov/doc/105-cmr-700-implementation-of-mgl-c94c-0/download",
              "exact_section": "105 CMR 700.006(A), (F)(4), (I)(3)",
              "checked_date": "2026-09-11"
            },
            {
              "official_url": "https://www.mass.gov/doc/105-cmr-700-implementation-of-mgl-c94c-0/download",
              "exact_section": "105 CMR 700.012(A)(1) (pharmacy reporting: Schedules II-V and Department-classified additional drugs)",
              "checked_date": "2026-09-11"
            }
          ]
        },
        {
          "severity": "Medium",
          "criterion": "material_exceptions",